{
  "schemaVersion": "project-audits/v1",
  "root": "/repo",
  "summary": {
    "projectCount": 2,
    "auditedProjectCount": 2,
    "skippedProjectCount": 0
  },
  "audits": [
    {
      "projectId": "apps/main",
      "projectRoot": "apps/main",
      "adapterId": "javascript",
      "audit": {
        "schemaVersion": "audit/v1",
        "profile": {
          "root": "/repo/apps/main"
        },
        "untestedCandidates": [],
        "coveredButRisky": [],
        "skipped": [],
        "risks": []
      }
    },
    {
      "projectId": "packages/auth-core",
      "projectRoot": "packages/auth-core",
      "adapterId": "javascript",
      "audit": {
        "schemaVersion": "audit/v1",
        "profile": {
          "root": "/repo/packages/auth-core"
        },
        "untestedCandidates": [],
        "coveredButRisky": [
          {
            "path": "src/authRoute.ts",
            "kind": "http-route",
            "recommendedTestLevel": "integration",
            "existingTestPaths": [
              "../../apps/main/tests/authRoute.test.ts"
            ]
          }
        ],
        "skipped": [],
        "risks": []
      }
    }
  ],
  "skippedProjects": []
}
